{
  "canonical_admission": "NOT_EVALUATED",
  "content_status": "declared_unverified",
  "current_authority": "NOT_EVALUATED",
  "epistemic_warrant": "NOT_EVALUATED",
  "format": "aiaeao.cube.vp02-print-report/1",
  "granularity": "standard",
  "lens": "neutral",
  "measurement_ref": "fixture:VP02/measurements/resource-counts-v1",
  "notices": [
    "All source declarations are unverified presentation inputs.",
    "Layout order, geometry, color and arrowheads do not assert semantic typing, causation or time truth."
  ],
  "printer_profile": "P2-VP-VIEWS/0.2.0",
  "reference_version": "v9.4",
  "render_status": "PASS",
  "sample_ids": [
    "artifact",
    "source",
    "evidence",
    "revisions"
  ],
  "semantic_conformance": "NOT_EVALUATED",
  "svg_sha256": "a1f1758fd04e35cc5f575d53b989f9c725460e315723311dae1f69c5606d8a1a",
  "unit": "items",
  "view": "cube.diagramm"
}
